PitchNo,Date,Time,PAofInning,PitchofPA,Pitcher,PitcherId,PitcherThrows,PitcherTeam,Batter,BatterId,BatterSide,BatterTeam,PitcherSet,Inning,Top/Bottom,Outs,Balls,Strikes,TaggedPitchType,AutoPitchType,PitchCall,KorBB,TaggedHitType,PlayResult,OutsOnPlay,RunsScored,Notes,RelSpeed,VertRelAngle,HorzRelAngle,SpinRate,SpinAxis,Tilt,RelHeight,RelSide,Extension,VertBreak,InducedVertBreak,HorzBreak,PlateLocHeight,PlateLocSide,ZoneSpeed,VertApprAngle,HorzApprAngle,ZoneTime,ExitSpeed,Angle,Direction,HitSpinRate,PositionAt110X,PositionAt110Y,PositionAt110Z,Distance,LastTrackedDistance,Bearing,HangTime,pfxx,pfxz,x0,y0,z0,vx0,vy0,vz0,ax0,ay0,az0,HomeTeam,AwayTeam,Stadium,Level,League,GameID,PitchUID,EffectiveVelo,MaxHeight,MeasuredDuration,SpeedDrop,PitchLastMeasuredX,PitchLastMeasuredY,PitchLastMeasuredZ,ContactPositionX,ContactPositionY,ContactPositionZ,GameUID,UTCDate,UTCTime,LocalDateTime,UTCDateTime,AutoHitType,System,HomeTeamForeignID,AwayTeamForeignID,GameForeignID,Catcher,CatcherId,CatcherThrows,CatcherTeam,PlayID,PitchTrajectoryXc0,PitchTrajectoryXc1,PitchTrajectoryXc2,PitchTrajectoryYc0,PitchTrajectoryYc1,PitchTrajectoryYc2,PitchTrajectoryZc0,PitchTrajectoryZc1,PitchTrajectoryZc2,HitSpinAxis,HitTrajectoryXc0,HitTrajectoryXc1,HitTrajectoryXc2,HitTrajectoryXc3,HitTrajectoryXc4,HitTrajectoryXc5,HitTrajectoryXc6,HitTrajectoryXc7,HitTrajectoryXc8,HitTrajectoryYc0,HitTrajectoryYc1,HitTrajectoryYc2,HitTrajectoryYc3,HitTrajectoryYc4,HitTrajectoryYc5,HitTrajectoryYc6,HitTrajectoryYc7,HitTrajectoryYc8,HitTrajectoryZc0,HitTrajectoryZc1,HitTrajectoryZc2,HitTrajectoryZc3,HitTrajectoryZc4,HitTrajectoryZc5,HitTrajectoryZc6,HitTrajectoryZc7,HitTrajectoryZc8,ThrowSpeed,PopTime,ExchangeTime,TimeToBase,CatchPositionX,CatchPositionY,CatchPositionZ,ThrowPositionX,ThrowPositionY,ThrowPositionZ,BasePositionX,BasePositionY,BasePositionZ,ThrowTrajectoryXc0,ThrowTrajectoryXc1,ThrowTrajectoryXc2,ThrowTrajectoryYc0,ThrowTrajectoryYc1,ThrowTrajectoryYc2,ThrowTrajectoryZc0,ThrowTrajectoryZc1,ThrowTrajectoryZc2,PitchReleaseConfidence,PitchLocationConfidence,PitchMovementConfidence,HitLaunchConfidence,HitLandingConfidence,CatcherThrowCatchConfidence,CatcherThrowReleaseConfidence,CatcherThrowLocationConfidence,Unnamed: 167
90,6/6/24,48:14.9,1.0,4.0,"Blain, Nathan",,Right,WES_WOO,"Marcoux, Noah",1000256051.0,Left,EAS_DIA,Undefined,3,Top,0,2,1,FourSeamFastBall,Sinker,InPlay,Undefined,FlyBall,HomeRun,0,1,,90.08935,-1.326866,-2.921255,2017.531565,223.027515,1:30,5.62101,1.98839,5.51468,-20.92328,13.99989,12.03792,2.63487,0.25762,82.42389,-5.229702,-0.77875,0.425332,104.43019,25.663883,11.871132,1564.849603,107.01534,49.27757,25.45012,432.35581,419.29101,16.947968,4.7238,-6.90197,7.76741,-1.74209,50.0,5.4914,6.13624,-130.66366,-3.74697,-11.95145,27.11603,-18.72396,WES_WOO,EAS_DIA,JimmyJohnsField,Independent,USP,20240606-JimmyJohnsField-1,3e33a600-245f-11ef-90db-51e89ee1294f,88.61883,74.4581,,7.66547,,,,1.62677,2.73934,-0.25128,0fffc226-e7f0-4bed-ab09-b0687dfda458,6/6/24,48:14.9,2024-06-06T19:48:14.9484592-04:00,2024-06-06T23:48:14.9484592Z,FlyBall,v3,,,,"Beadle, Zachary",1000238536.0,Right,WES_WOO,f004918e-f396-4101-b0a9-7655bee5342f,54.98456,-131.69401,13.55802,5.62026,-3.03549,-9.36198,-1.98388,6.59038,-5.97573,207.888161,1.62788,135.07623,-23.33983,5.54516,-0.98484,0.12209,-0.0128,0.00162,-0.00012,2.7408,66.29831,-16.11653,0.05143,0.36948,-0.19228,0.05581,-0.00814,0.00046,-0.25108,28.39769,1.05312,-0.88147,0.23434,-0.03002,0.00044,0.00032,-3e-05,,,,,,,,,,,,,,,,,,,,,,,High,High,High,High,Medium,,,,
28,6/14/24,18:21.6,3.0,5.0,"Blain, Nathan",,Right,WES_WOO,"Marcoux, Noah",1000256051.0,Left,EAS_DIA,Undefined,1,Bottom,0,2,2,Slider,Slider,InPlay,Undefined,GroundBall,Single,0,1,,83.15183,-0.017638,-0.975911,2587.750865,81.938349,8:45,5.59324,1.87857,4.99257,-41.99408,-0.57224,-12.30241,2.07708,-0.06815,77.0615,-7.588401,-3.149524,0.463219,94.972,4.358755,35.042893,3418.538718,,,,89.4773,88.04968,36.623349,0.697731,5.91378,0.01157,-1.77398,50.0,5.55693,2.57884,-120.81462,-1.62465,8.81117,21.7587,-32.15678,EAS_DIA,WES_WOO,JimmyJohnsField,Independent,USP,20240614-JimmyJohnsField-1,649f7670-2aa4-11ef-a340-b7abb4ccd017,81.37075,3.87678,,6.09033,,,,1.70754,2.58623,0.0335,75ff1cfb-2fa3-40ee-8bfb-f5065b7a120b,6/14/24,18:21.6,2024-06-14T19:18:21.6336030-04:00,2024-06-14T23:18:21.6336030Z,GroundBall,v3,,,,"Beadle, Zachary",1000238536.0,Right,WES_WOO,122a9e10-56fc-4e19-9e53-680186ad8394,55.50942,-121.80282,10.87935,5.59755,-0.1642,-16.07839,-1.88201,2.17866,4.40559,,1.75552,112.77808,-17.822,,,,,,,2.62446,9.84267,-19.57018,,,,,,,0.03176,79.78627,-4.76963,,,,,,,,,,,,,,,,,,,,,,,,,,,,,High,High,High,High,High,,,,
12,6/12/24,07:30.1,3.0,5.0,"Bonnett, Garrett",1000256064.0,Right,UTI_UNI,"Marcoux, Noah",1000256051.0,Left,EAS_DIA,Undefined,1,Top,1,2,2,FourSeamFastBall,Four-Seam,InPlay,Undefined,LineDrive,Sacrifice,1,1,,91.50742,-2.268071,-0.962312,2275.811765,206.570654,1:00,6.12613,0.12387,5.45897,-15.22961,18.74792,8.82382,2.73259,-0.04166,83.52404,-5.152916,0.608768,0.419534,86.46338,23.801033,6.475011,1606.782952,109.44743,39.37965,11.01079,301.86188,294.9652,5.236578,3.531843,-4.73579,10.43083,-0.0454,50.0,5.91616,1.83065,-132.74478,-5.74019,-8.43879,28.77332,-13.58712,UTI_UNI,EAS_DIA,JimmyJohnsField,Independent,USP,20240612-JimmyJohnsField-1,40cad4a0-28de-11ef-8b29-11e9415d87e6,89.84359,44.90712,,7.98337,,,,1.68856,2.83443,0.0575,7fab0ec4-d590-4f6d-8b27-e23c808c6f4b,6/12/24,07:30.1,2024-06-12T13:07:30.0950000-04:00,2024-06-12T17:07:30.0950000Z,LineDrive,v3,,,,"Krizen, Ethan",,Right,UTI_UNI,79024423-83c1-42e2-9a8a-6dc46f6a2b31,55.03961,-133.8327,14.38666,6.12348,-5.22647,-6.79356,-0.12065,2.14972,-4.21939,166.840626,1.68846,115.28912,-16.95779,4.12164,-0.88323,0.2103,-0.05213,0.00864,-0.0006,2.83444,51.17911,-16.46613,0.59752,0.00293,-0.04488,0.01838,-0.00273,0.00011,0.05765,13.07857,-3.56229,1.0642,-0.20933,0.0301,-0.00469,0.00084,-7e-05,,,,,,,,,,,,,,,,,,,,,,,High,High,High,High,High,,,,
23,5/25/24,42:03.9,3.0,2.0,"Colucci, Matthew",1000227708.0,Right,UTI_UNI,"Marcoux, Noah",1000256051.0,Left,EAS_DIA,Undefined,1,Bottom,1,0,1,TwoSeamFastBall,Sinker,InPlay,Undefined,GroundBall,Single,0,0,,90.57677,-1.551192,-2.20645,2274.90561,232.38247,1:45,5.83277,1.40317,5.57492,-25.62206,8.93937,10.14851,2.24734,0.187,82.75994,-6.291283,-0.3957,0.423124,,,,,,,,,,,,-5.77941,5.29662,-1.22005,50.0,5.68243,4.61342,-131.3936,-4.4819,-10.08091,28.42341,-22.9353,EAS_DIA,UTI_UNI,JimmyJohnsField,Independent,USP,20240525-JimmyJohnsField-1,a08625f0-1adf-11ef-914d-69e781a600bf,89.08136,,,7.81683,,,,,,,e5e32f23-4cd1-44f4-b9bc-a30610ecce2a,5/25/24,42:03.9,2024-05-25T17:42:03.8711654-04:00,2024-05-25T21:42:03.8711654Z,,v3,,,,"Crump, Alex",1000079472.0,Right,UTI_UNI,61db24ca-a88f-481e-9546-4b214f846e1f,54.92387,-132.45447,14.21171,5.83374,-3.62588,-11.46765,-1.39926,4.98968,-5.04046,,,,,,,,,,,,,,,,,,,,,,,,,,,,,,,,,,,,,,,,,,,,,,,,,,,High,High,High,,,,,,
286,5/29/24,27:50.5,3.0,3.0,"Colucci, Matthew",1000227708.0,Right,UTI_UNI,"Marcoux, Noah",1000256051.0,Left,EAS_DIA,Undefined,7,Top,1,2,0,TwoSeamFastBall,Four-Seam,InPlay,Undefined,GroundBall,Single,0,0,,88.79208,-1.236023,-2.612049,2344.146959,218.117081,1:15,6.02,1.47967,5.41936,-21.24985,15.35304,11.00631,3.08998,-0.05162,80.0745,-5.230184,-0.656014,0.435441,77.97965,10.539117,24.318199,1757.165868,,,,126.78132,124.66863,28.434422,1.303576,-6.37437,8.49461,-1.25558,50.0,5.89584,5.37263,-128.57724,-3.48567,-10.52431,30.07961,-18.14914,UTI_UNI,EAS_DIA,JimmyJohnsField,Independent,USP,20240529-JimmyJohnsField-1,c66878f0-1de0-11ef-86e9-d95ec75379f0,86.56158,8.96718,,8.71758,,,,1.10133,3.11272,0.01999,84c84578-4bdb-48f0-a122-56159aeb0471,5/29/24,27:50.5,2024-05-29T13:27:50.4510398-04:00,2024-05-29T17:27:50.4510398Z,GroundBall,v3,,,,"Crump, Alex",1000079472.0,Right,UTI_UNI,5ac5ace2-f9de-4bdb-8b1a-2d4555afd5bf,55.07737,-129.75962,15.03981,6.01884,-2.77226,-9.07457,-1.4749,5.78632,-5.26216,267.223472,1.10133,102.46402,-18.21352,4.57474,-1.03427,0.21393,-0.05217,0.01371,-0.00215,3.11272,20.91904,-19.35382,1.24905,-0.07804,-0.02174,0.0119,-0.00219,0.00022,0.01999,46.30347,1.12134,-1.34895,0.51286,-0.14501,0.03393,-0.00555,0.00046,,,,,,,,,,,,,,,,,,,,,,,High,High,High,High,High,,,,
73,6/7/24,42:54.6,1.0,2.0,"Colucci, Matthew",1000120362.0,Right,UTI_UNI,"Marcoux, Noah",1000256051.0,Left,EAS_DIA,Undefined,3,Top,0,1,0,TwoSeamFastBall,Sinker,InPlay,Undefined,FlyBall,Double,0,0,,89.87874,-0.841627,-2.573569,2362.498279,247.280703,2:15,5.95274,1.35972,5.29681,-30.11273,4.96607,9.45245,2.65232,-0.27044,83.02256,-6.334444,-0.896203,0.426279,86.40034,25.449429,32.0438,2164.611421,89.02245,41.52606,64.61338,309.39593,309.39593,41.87085,3.557817,-5.4141,2.9902,-1.13282,50.0,5.85402,5.44411,-130.49998,-3.07604,-9.4261,24.99544,-26.968,UTI_UNI,EAS_DIA,JimmyJohnsField,Independent,USP,20240607-JimmyJohnsField-1,a9a96d20-2527-11ef-8387-c11366ec84e5,88.42202,47.26799,,6.85618,,,,1.69394,2.84703,0.44106,9830c4d7-7d3d-4c49-ba28-1e578d3810c5,6/7/24,42:54.6,2024-06-07T19:42:54.6052102-04:00,2024-06-07T23:42:54.6052102Z,LineDrive,v3,,,,"Shinn, Tyler",10015307.0,Right,UTI_UNI,a8024f2a-3a8b-486b-ab58-1b337047d47b,55.20396,-131.49294,12.49772,5.95494,-2.00471,-13.484,-1.35654,5.81857,-4.71305,,1.69367,96.99573,-18.34102,4.59049,-0.96538,0.20418,-0.04666,0.00779,-0.00055,2.84733,54.44794,-17.95635,0.88947,-0.07644,-0.00372,0.00299,0.0003,-0.00012,0.44095,60.71512,-0.42766,-0.27122,0.02994,0.03168,-0.01412,0.00242,-0.00015,,,,,,,,,,,,,,,,,,,,,,,High,High,High,High,Medium,,,,
204,6/19/24,54:49.0,1.0,4.0,"Cox, Brennan",1000305527.0,Left,BIR_BLO,"Marcoux, Noah",1000256051.0,Left,EAS_DIA,Undefined,5,Bottom,0,3,0,FourSeamFastBall,Cutter,InPlay,Undefined,LineDrive,Single,0,0,,83.84294,-1.047021,2.72143,2341.49468,181.552837,12:00,5.62811,-1.95285,5.31979,-26.88194,13.58993,0.33532,2.40413,0.63098,77.16277,-5.999295,2.780878,0.457876,75.49402,12.11976,26.443509,2796.124164,,,,117.41813,116.04315,29.395554,1.230087,0.54701,7.46469,1.70605,50.0,5.51397,-5.79557,-121.63336,-3.13733,0.8237,22.70069,-20.93316,EAS_DIA,BIR_BLO,JimmyJohnsField,Independent,USP,20240619-JimmyJohnsField-1,6773a5c0-2e6d-11ef-935f-6177da4042b5,82.32017,8.6154,,6.68017,,,,1.87348,2.37221,-0.6832,45325636-7be3-42f6-8b52-16f5635ff381,6/19/24,54:49.0,2024-06-19T14:54:49.0190656-04:00,2024-06-19T18:54:49.0190656Z,LineDrive,v3,,,,"Torres, Ray",687999.0,Right,BIR_BLO,541dfaf3-d3d4-4b13-ae75-e041d6c46c87,55.17957,-122.59622,11.35034,5.62821,-2.24943,-10.46658,1.95261,-5.83051,0.41185,292.599971,1.87348,96.92924,-15.04085,2.61366,-0.24857,-0.46316,0.50405,-0.23592,0.04242,2.37222,23.24701,-22.80687,2.3698,-0.41189,-0.05682,0.12748,-0.06269,0.01127,-0.6832,48.20929,-0.03333,-0.58173,-0.24538,0.77804,-0.77493,0.36455,-0.06685,,,,,,,,,,,,,,,,,,,,,,,High,High,High,High,High,,,,
219,6/16/24,59:54.9,3.0,4.0,"Evers, Aaron",,Right,WES_WOO,"Marcoux, Noah",1000256051.0,Left,EAS_DIA,Undefined,7,Top,2,1,2,Curveball,Curveball,InPlay,Undefined,FlyBall,HomeRun,0,1,,80.32093,2.708009,-0.041695,2264.407645,23.980736,6:45,5.58708,1.56159,5.10958,-59.53617,-14.74166,-7.19485,3.17894,0.92273,73.43043,-8.040851,-1.315902,0.481708,99.85806,38.153002,-12.61952,3612.074697,105.32259,81.59283,-31.73559,382.09503,256.30838,-22.475679,5.580013,3.57799,-7.75674,-1.55171,50.0,5.79506,0.38375,-116.51462,3.28874,4.89326,22.94461,-42.78214,WES_WOO,EAS_DIA,JimmyJohnsField,Independent,USP,20240616-JimmyJohnsField-1,9eb63730-2c12-11ef-83e6-27954b085391,78.24747,115.29627,,6.8905,,,,0.67081,3.03174,-0.86333,5838d70f-5d3b-4095-bbff-bf409cffacdf,6/16/24,59:54.9,2024-06-16T14:59:54.8600000-04:00,2024-06-16T18:59:54.8600000Z,FlyBall,v3,,,,"Beadle, Zachary",1000238536.0,Right,WES_WOO,fb8e561b-42be-479c-9404-eddc29ef6f90,55.39339,-117.57191,11.47231,5.59809,5.26015,-21.39107,-1.5642,0.15827,2.44663,152.958851,0.67627,112.27752,-24.78805,6.11858,-0.88682,0.0186,0.01717,-0.00259,0.00012,3.03052,90.49072,-20.8145,1.19692,-0.01147,-0.06063,0.02086,-0.003,0.00016,-0.86329,-25.1674,-2.28271,1.07404,-0.23383,0.01901,0.00259,-0.00065,4e-05,,,,,,,,,,,,,,,,,,,,,,,High,High,High,High,Low,,,,
16,5/29/24,12:11.0,3.0,7.0,"Krizen, Benjamin",1000120362.0,Right,UTI_UNI,"Marcoux, Noah",1000256051.0,Left,EAS_DIA,Undefined,1,Top,1,3,2,FourSeamFastBall,Four-Seam,InPlay,Undefined,GroundBall,Single,0,1,,90.46854,-0.620999,-1.854756,2267.077421,218.026301,1:15,5.85963,1.11385,5.38852,-17.9354,16.85273,12.3141,3.78265,0.40102,82.5584,-3.994294,0.33365,0.424509,86.96475,6.741623,26.441458,2316.17023,,,,101.95805,100.56731,28.748741,0.891437,-6.7354,8.98402,-0.95724,50.0,5.7919,3.69731,-131.29376,-2.02316,-11.75548,27.82653,-16.49395,UTI_UNI,EAS_DIA,JimmyJohnsField,Independent,USP,20240529-JimmyJohnsField-1,d2e6d8a0-1dcd-11ef-86e9-d95ec75379f0,88.79067,6.25428,,7.91014,,,,1.00719,3.82955,-0.46606,84c84578-4bdb-48f0-a122-56159aeb0471,5/29/24,12:11.0,2024-05-29T11:12:11.0044606-04:00,2024-05-29T15:12:11.0044606Z,GroundBall,v3,,,,"Crump, Alex",1000079472.0,Right,UTI_UNI,3812e81f-2fd0-4a26-b621-49f57f209ab3,55.11054,-132.37246,13.91326,5.85794,-1.38377,-8.24697,-1.1094,4.15302,-5.87774,302.853847,1.07111,112.4361,-15.06099,,,,,,,3.90788,13.77354,-20.45852,,,,,,,-0.48935,56.76438,-1.32544,,,,,,,,,,,,,,,,,,,,,,,,,,,,,High,High,High,High,High,,,,
13,6/7/24,11:04.8,3.0,7.0,"Krizen, Benjamin",1000120362.0,Right,UTI_UNI,"Marcoux, Noah",1000256051.0,Left,EAS_DIA,Undefined,1,Top,1,3,2,FourSeamFastBall,Four-Seam,InPlay,Undefined,FlyBall,HomeRun,0,2,,89.7482,-1.586521,-0.97286,2132.209462,215.746518,1:15,6.00077,0.85891,5.353,-17.69127,17.75808,11.95477,3.03793,0.94263,81.89252,-4.913185,1.151567,0.428524,99.19538,28.587387,6.803293,1545.91618,109.03689,54.78568,14.52213,400.61681,398.51538,9.997058,4.767003,-6.29784,9.71438,-0.78035,50.0,5.84585,1.67347,-130.22088,-4.19006,-10.79622,27.7685,-15.52096,UTI_UNI,EAS_DIA,JimmyJohnsField,Independent,USP,20240607-JimmyJohnsField-1,374b0080-2523-11ef-8387-c11366ec84e5,87.95869,77.82165,,7.85569,,,,1.51662,3.19678,-0.93561,9830c4d7-7d3d-4c49-ba28-1e578d3810c5,6/7/24,11:04.8,2024-06-07T19:11:04.7916038-04:00,2024-06-07T23:11:04.7916038Z,FlyBall,v3,,,,"Shinn, Tyler",10015307.0,Right,UTI_UNI,31f9646f-bbfa-453a-b453-94b95569078e,55.1456,-131.31355,13.88425,5.99871,-3.57932,-7.76048,-0.85456,2.09829,-5.39811,202.073677,1.51898,126.79842,-20.83315,4.65218,-0.75689,0.08126,-0.00846,0.00144,-0.00012,3.19742,69.5956,-17.92358,0.76809,0.18495,-0.17148,0.05674,-0.00859,0.00049,-0.93561,15.13523,1.36868,-0.84641,0.24899,-0.05461,0.00919,-0.00101,5e-05,,,,,,,,,,,,,,,,,,,,,,,High,High,High,High,High,,,,
100,5/31/24,20:48.5,3.0,1.0,"LaGuire-Cruz, Jonathon",1000216317.0,Right,BIR_BLO,"Marcoux, Noah",1000256051.0,Left,EAS_DIA,Undefined,7,Bottom,1,0,0,FourSeamFastBall,Four-Seam,InPlay,Undefined,LineDrive,Double,0,0,,92.55249,-2.586553,-2.559431,2401.519038,194.343213,12:30,5.77085,2.3532,5.88317,-11.40465,21.45722,5.20292,2.41447,0.40842,84.1248,-4.812059,-1.62732,0.412589,104.8528,18.697854,-5.188634,1433.492123,108.94046,32.24488,-15.23054,339.91628,339.91628,-12.893765,3.325963,-3.42091,12.08375,-2.14958,50.0,5.55537,5.76962,-134.15294,-6.34996,-6.20173,30.4345,-10.26765,EAS_DIA,BIR_BLO,JimmyJohnsField,Independent,USP,20240531-JimmyJohnsField-1,2dd63790-1fb5-11ef-a13e-8509a7af9850,91.35592,40.21575,,8.42768,,,,1.62166,2.53,-0.42762,2c8f7f19-c6f4-4521-a690-3116d6eb9307,6/1/24,20:48.5,2024-05-31T21:20:48.4880000-04:00,2024-06-01T01:20:48.4880000Z,LineDrive,v3,,,,"Stevanovic, Ranko ",1000056563.0,Right,BIR_BLO,797177f9-f559-4f0f-8050-9d3470b0af70,54.61494,-135.19585,15.21725,5.76694,-5.99811,-5.13383,-2.35094,5.98214,-3.10086,128.547112,1.62169,145.0709,-24.98877,5.91335,-1.37019,0.32887,-0.071,0.01011,-0.00064,2.52997,49.29842,-17.22673,0.67055,0.15069,-0.13713,0.04834,-0.0083,0.00058,-0.42762,-13.17146,-6.95591,2.58573,-0.86836,0.2887,-0.07656,0.01226,-0.00084,,,,,,,,,,,,,,,,,,,,,,,High,High,High,High,High,,,,
13,5/18/24,39:26.9,3.0,3.0,"Loukinen, Greg",1000269815.0,Left,BIR_BLO,"Marcoux, Noah",1000256051.0,Left,EAS_DIA,Undefined,1,Top,2,1,1,FourSeamFastBall,Sinker,InPlay,Undefined,FlyBall,Single,0,0,,88.81642,0.14064,3.759864,2156.576473,116.615487,10:00,5.38089,-1.73415,5.87068,-25.25139,10.83406,-18.97458,3.40752,0.18201,79.79974,-4.612078,0.363899,0.432352,65.57939,41.667149,-18.274343,4507.461526,99.40846,61.74522,-47.09512,201.28326,171.94129,-29.961268,4.065766,10.89292,5.86981,1.44049,50.0,5.37786,-7.63237,-128.59471,-0.50852,17.94273,30.7239,-22.50536,BIR_BLO,EAS_DIA,JimmyJohnsField,Independent,USP,20240518-JimmyJohnsField-1,1a28e9a0-155f-11ef-bad7-ebb455bef4ec,87.17997,61.74179,,9.01668,,,,0.90594,3.43505,-0.2025,84599607-5f8c-4b9a-ba62-b6292030881a,5/18/24,39:26.9,2024-05-18T17:39:26.9054754-04:00,2024-05-18T21:39:26.9054754Z,Popup,v3,,,,"Stevanovic, Ranko",,Right,BIR_BLO,b1aeb46c-fd56-46e6-8cae-6ca446dfc16b,54.62643,-129.69535,15.36195,5.38164,0.2977,-11.25268,1.72542,-8.27514,8.97136,142.980246,0.9081,68.17222,-12.56616,2.44077,-0.0753,-0.13932,0.03784,-0.00291,-3e-05,3.43534,63.92852,-19.45936,1.15933,0.11527,-0.21237,0.0877,-0.01577,0.00105,-0.20251,-22.52713,-2.23823,1.01116,-0.32517,0.1092,-0.0327,0.00574,-0.0004,,,,,,,,,,,,,,,,,,,,,,,High,High,High,High,Medium,,,,
32,6/19/24,18:26.9,3.0,2.0,"Maldonado, Matthew",809564.0,Right,BIR_BLO,"Marcoux, Noah",1000256051.0,Left,EAS_DIA,Undefined,1,Bottom,0,1,0,FourSeamFastBall,Four-Seam,InPlay,Undefined,LineDrive,Single,0,1,,87.55298,-1.010717,-1.68605,2210.271208,196.031019,12:30,5.2814,1.79131,5.99979,-21.82647,14.32765,3.80032,2.5255,0.54526,80.37447,-5.111528,-1.002804,0.432763,94.51878,11.589378,-25.873176,3015.413783,95.07613,13.09241,-55.32196,191.58234,191.58234,-33.20429,1.745477,-2.41138,7.98134,-1.66075,50.0,5.18982,3.59129,-127.21113,-2.91517,-3.96579,25.209,-19.04782,EAS_DIA,BIR_BLO,JimmyJohnsField,Independent,USP,20240619-JimmyJohnsField-1,f13507d0-2e5f-11ef-935f-6177da4042b5,87.09717,13.26962,,7.17852,,,,0.43179,2.52906,-0.50998,45325636-7be3-42f6-8b52-16f5635ff381,6/19/24,18:26.9,2024-06-19T13:18:26.9127488-04:00,2024-06-19T17:18:26.9127488Z,LineDrive,v3,,,,"Torres, Ray",687999.0,Right,BIR_BLO,73b7d8d7-b419-4937-95ce-cae3df869d0a,54.49904,-128.09958,12.6045,5.28073,-2.24386,-9.52391,-1.78978,3.73106,-1.98289,97.985356,0.43178,122.18984,-23.12833,4.42077,-0.85923,0.08766,0.01644,-0.01008,0.00155,2.52906,27.84961,-19.37792,1.95353,-0.37065,0.07814,-0.01508,0.00276,-0.0003,-0.50999,-59.25891,-2.91387,2.42358,-0.74948,0.12262,0.01675,-0.01378,0.00227,,,,,,,,,,,,,,,,,,,,,,,High,High,High,High,High,,,,
199,6/14/24,49:10.7,4.0,2.0,"Myer, Jacob",815236.0,Left,WES_WOO,"Marcoux, Noah",1000256051.0,Left,EAS_DIA,Undefined,6,Bottom,1,0,1,ChangeUp,Changeup,InPlay,Undefined,GroundBall,Double,0,1,,85.71194,-1.22221,2.202965,1774.856913,114.228514,9:45,6.03552,-1.26033,5.5261,-32.13852,6.99855,-12.40768,2.21369,-0.23382,77.50341,-7.162079,-0.009962,0.450262,95.86809,-1.484277,41.248465,4802.168289,,,,49.67338,43.35674,41.089502,0.364647,6.98807,4.32969,1.07734,50.0,5.90797,-4.24802,-124.18215,-3.77153,10.74623,28.39856,-25.51588,EAS_DIA,WES_WOO,JimmyJohnsField,Independent,USP,20240614-JimmyJohnsField-1,14873d00-2ab1-11ef-a340-b7abb4ccd017,83.71221,2.78812,,8.20853,,,,1.50371,2.78812,0.29401,75ff1cfb-2fa3-40ee-8bfb-f5065b7a120b,6/15/24,49:10.7,2024-06-14T20:49:10.7090000-04:00,2024-06-15T00:49:10.7090000Z,GroundBall,v3,,,,"Beadle, Zachary",1000238536.0,Right,WES_WOO,959f88bf-2b0d-4a90-909e-9a8ed31a9a01,54.97124,-125.31384,14.19928,6.038,-2.75471,-12.75794,1.25515,-4.67626,5.37311,,1.51333,105.32714,-18.73916,,,,,,,2.78861,-3.65957,-10.94004,,,,,,,0.29819,92.52111,-10.47296,,,,,,,,,,,,,,,,,,,,,,,,,,,,,High,High,High,Medium,Medium,,,,
161,6/16/24,31:14.1,1.0,2.0,"Myer, Jacob",815236.0,Left,WES_WOO,"Marcoux, Noah",1000256051.0,Left,EAS_DIA,Undefined,6,Top,0,1,0,Slider,Slider,InPlay,Undefined,LineDrive,Double,0,0,,79.83804,0.454053,1.669836,2078.043746,301.375019,4:00,6.00157,-1.39219,5.17919,-46.66731,-1.37476,4.69662,2.54005,0.57082,72.97486,-8.022837,2.502274,0.484378,97.60027,19.544492,-7.088006,1697.603772,108.13007,33.18098,-20.19415,330.73028,330.73028,-16.536022,3.415121,-1.855,-0.41512,1.23311,50.0,6.00815,-3.56726,-115.78943,-0.74125,-2.50105,23.00833,-32.73374,WES_WOO,EAS_DIA,JimmyJohnsField,Independent,USP,20240616-JimmyJohnsField-1,9d115da0-2c0e-11ef-83e6-27954b085391,77.81611,40.18431,,6.86318,,,,0.62053,2.44359,-0.6017,5838d70f-5d3b-4095-bbff-bf409cffacdf,6/16/24,31:14.1,2024-06-16T14:31:14.1231774-04:00,2024-06-16T18:31:14.1231774Z,LineDrive,v3,,,,"Beadle, Zachary",1000238536.0,Right,WES_WOO,7e78b46f-7a2b-4639-b626-1d744d2840b1,55.32015,-116.8418,11.50416,6.00781,0.75596,-16.36687,1.39366,-3.45287,-1.25053,128.619127,0.62066,133.86434,-21.39854,4.69603,-0.90856,0.13015,-0.00822,-0.00096,0.00017,2.44347,47.89013,-16.22682,0.75898,-0.11739,0.05221,-0.02055,0.00455,-0.00039,-0.6017,-16.644,-6.76982,2.08157,-0.54014,0.11673,-0.01969,0.0022,-0.00011,,,,,,,,,,,,,,,,,,,,,,,High,High,High,High,Medium,,,,
75,5/18/24,55:11.4,3.0,2.0,"Pichardo, Julian",,Right,BIR_BLO,"Marcoux, Noah",1000256051.0,Left,EAS_DIA,Undefined,3,Top,0,1,0,Cutter,Slider,InPlay,Undefined,LineDrive,Single,0,0,,84.4054,-0.789062,-2.056927,2272.021011,187.617507,12:15,5.91965,1.43804,5.96627,-26.49084,12.89993,1.54736,2.97996,-0.34098,76.75204,-5.759814,-1.778986,0.451719,85.07498,18.958877,25.0354,1210.460142,97.59318,23.80199,50.74964,209.25253,209.25253,29.592744,2.300659,-1.41823,7.25445,-1.27585,50.0,5.8424,4.33815,-122.47875,-2.49391,-2.13688,26.01621,-21.24351,BIR_BLO,EAS_DIA,JimmyJohnsField,Independent,USP,20240518-JimmyJohnsField-2,725b1560-157a-11ef-bad7-ebb455bef4ec,83.44219,23.8079,,7.65336,,,,1.34932,2.9966,0.29743,ce83b0f6-978d-4e8b-8cac-5f9e1ff2a187,5/19/24,55:11.4,2024-05-18T20:55:11.4038482-04:00,2024-05-19T00:55:11.4038482Z,LineDrive,v3,,,,"Torres, Ray",,Right,BIR_BLO,e21e796a-a1f4-49e4-bdec-c30d59e169bd,54.53145,-123.43754,13.00811,5.91988,-1.71101,-10.62176,-1.43718,4.41691,-1.06844,260.090357,1.34933,106.92089,-17.77926,3.69743,-0.97934,0.36339,-0.14487,0.03521,-0.00359,2.9966,40.53865,-21.60035,2.13745,-0.41904,0.07977,-0.01197,0.00145,-0.0001,0.29742,49.93817,-1.27572,-0.89427,0.4785,-0.27142,0.11967,-0.03031,0.00315,,,,,,,,,,,,,,,,,,,,,,,High,High,High,High,High,,,,
117,5/21/24,02:13.7,4.0,1.0,"Ruble, Nathan",,Left,BIR_BLO,"Marcoux, Noah",1000256051.0,Left,EAS_DIA,Undefined,3,Top,1,0,0,Curveball,Curveball,InPlay,Undefined,FlyBall,HomeRun,0,3,,72.77796,1.411116,0.251286,2353.936431,297.021183,4:00,5.86764,-1.67667,5.61103,-59.06972,-5.86815,14.65595,2.26256,-0.2208,67.24734,-9.349025,2.873086,0.524969,88.18325,33.145826,25.615552,1733.668248,98.83781,61.24795,48.28106,352.00566,352.00566,27.340219,4.710012,-7.41615,-2.96764,1.6453,50.0,5.94955,-0.97478,-105.77491,0.79067,-8.39846,18.11245,-35.53479,BIR_BLO,EAS_DIA,JimmyJohnsField,Independent,USP,20240521-JimmyJohnsField-1,423373e0-179c-11ef-88f5-354633d59584,71.79938,78.57353,,5.53063,,,,1.78314,2.36898,0.21219,af5747fd-2385-48de-b4bb-8cff7ee6d15d,5/21/24,02:13.7,2024-05-21T14:02:13.7480000-04:00,2024-05-21T18:02:13.7480000Z,FlyBall,v3,,,,"Stevanovic, Ranko",,Right,BIR_BLO,0bbb865e-d86e-4181-8b4c-c86592edecca,54.89178,-106.60927,9.05622,5.87543,2.4276,-17.7674,1.68129,-0.5879,-4.19923,189.895343,1.7845,97.61862,-15.37345,3.61713,-0.6661,0.10458,-0.01653,0.00221,-0.00014,2.36924,70.70623,-18.21564,0.94487,0.05458,-0.10612,0.03599,-0.0054,0.00031,0.21272,46.80631,-5.81015,1.27884,-0.22336,0.03635,-0.00692,0.00105,-7e-05,,,,,,,,,,,,,,,,,,,,,,,High,High,High,High,High,,,,
170,5/21/24,28:30.2,4.0,3.0,"Ruble, Nathan",,Left,BIR_BLO,"Marcoux, Noah",1000256051.0,Left,EAS_DIA,Undefined,4,Top,1,1,1,FourSeamFastBall,Sinker,InPlay,Undefined,GroundBall,Single,0,1,,87.30487,-2.652684,2.869194,2096.832118,137.109262,10:30,6.03992,-1.31884,6.20354,-22.15202,13.93985,-11.93784,1.74056,0.33694,80.4826,-6.806103,0.715569,0.43239,96.94803,1.163824,3.26625,2090.59455,,,,44.10846,44.10846,3.240205,0.316597,6.96422,8.25997,1.10915,50.0,5.82905,-5.88963,-126.72682,-6.53768,11.39684,24.36549,-18.65676,BIR_BLO,EAS_DIA,JimmyJohnsField,Independent,USP,20240521-JimmyJohnsField-1,edc7d4f0-179f-11ef-88f5-354633d59584,87.17226,1.73537,,6.82228,,,,1.04707,1.65744,-0.3671,af5747fd-2385-48de-b4bb-8cff7ee6d15d,5/21/24,28:30.2,2024-05-21T14:28:30.1680000-04:00,2024-05-21T18:28:30.1680000Z,GroundBall,v3,,,,"Stevanovic, Ranko",,Right,BIR_BLO,d40f131a-a362-4955-8234-90030c93ec9a,54.29656,-127.55024,12.18274,6.03933,-5.90719,-9.32838,1.3147,-6.27478,5.69842,337.166002,1.05018,141.79922,-19.04014,,,,,,,1.66315,2.6476,-25.0108,,,,,,,-0.36848,8.15826,2.7938,,,,,,,,,,,,,,,,,,,,,,,,,,,,,High,High,High,Medium,High,,,,
215,5/29/24,56:12.1,3.0,4.0,"Severini, Andrew",1000238531.0,Right,UTI_UNI,"Marcoux, Noah",1000256051.0,Left,EAS_DIA,Undefined,6,Top,0,3,0,FourSeamFastBall,Sinker,InPlay,Undefined,LineDrive,Double,0,1,,88.40921,-0.621772,-3.999108,2156.535232,245.456147,2:15,5.66262,2.49678,5.9921,-26.96084,9.14733,17.23056,2.83824,0.22053,79.91614,-5.674065,-0.908459,0.432488,102.41642,21.733285,25.729155,1556.258273,95.32186,35.90163,54.89717,307.71384,233.17716,37.750723,3.146026,-10.10508,5.26209,-2.19067,50.0,5.59877,8.23497,-128.05692,-2.27107,-16.58097,29.36833,-23.53975,UTI_UNI,EAS_DIA,JimmyJohnsField,Independent,USP,20240529-JimmyJohnsField-1,5af39c20-1ddc-11ef-86e9-d95ec75379f0,87.15253,41.6439,,8.49307,,,,1.11043,2.89278,-0.10152,84c84578-4bdb-48f0-a122-56159aeb0471,5/29/24,56:12.1,2024-05-29T12:56:12.1458110-04:00,2024-05-29T16:56:12.1458110Z,LineDrive,v3,,,,"Crump, Alex",1000079472.0,Right,UTI_UNI,9531c2ba-81a5-4433-a55e-de4b694be8fd,54.50614,-129.08621,14.68417,5.66391,-1.44606,-11.76988,-2.48947,8.8161,-8.29049,,1.11051,125.69247,-26.70283,6.0437,-1.09069,0.06461,0.03429,-0.01101,0.00106,2.89276,55.62288,-22.52564,2.31785,-0.52086,0.15573,-0.04427,0.00828,-0.00067,-0.10145,60.57599,2.98387,-2.10467,0.50557,-0.0223,-0.02596,0.00757,-0.0007,,,,,,,,,,,,,,,,,,,,,,,High,High,High,High,Medium,,,,
